{"schema_version":6,"event_type":"sample","sequence":17,"target_gpu_uuid":"GPU-11111111-2222-3333-4444-555555555555","gpu_index":0,"gpu_name":"NVIDIA GeForce RTX 3060","observed_at_unix_ms":1788661824538,"status":"ok","status_code":0,"message":"","consecutive_failures":0,"retry_after_ms":0,"sample":{"temperature_c":51,"sensor":"gpu_die","backend":"NVML nvmlDeviceGetTemperatureV","timestamp_unix_ms":1788661824538},"alert_threshold_c":null,"alert_hysteresis_c":null,"public_telemetry":{"gpu_index":0,"captured_at_unix_ms":1788661824538,"coverage":{"total":37,"available":32,"not_supported":5,"provider_unavailable":0,"query_failed":0},"performance_limit_reasons":{"raw_bitmask":0,"active_reasons":[],"primary_reason":"none"},"fields":[{"field":"gpu_die_temperature_c","provider":"NVML nvmlDeviceGetTemperatureV","provider_native_id":0,"state":"available","origin":"driver_reported","value_type":"signed_integer","unit":"celsius","value_u64":null,"value_i64":51,"value_f64":null,"native_status":0,"timestamp_unix_ms":1788661824538},{"field":"memory_temperature_c","provider":"NVML nvmlDeviceGetFieldValues","provider_native_id":82,"state":"not_supported","origin":"driver_reported","value_type":"unknown","unit":"celsius","value_u64":null,"value_i64":null,"value_f64":null,"native_status":3,"timestamp_unix_ms":1788661824538},{"field":"total_energy_mj","provider":"NVML nvmlDeviceGetFieldValues","provider_native_id":83,"state":"available","origin":"driver_reported","value_type":"unsigned_integer","unit":"millijoule","value_u64":2192180272,"value_i64":null,"value_f64":null,"native_status":0,"timestamp_unix_ms":1788661824539},{"field":"power_average_mw","provider":"NVML nvmlDeviceGetFieldValues","provider_native_id":185,"state":"available","origin":"driver_reported","value_type":"unsigned_integer","unit":"milliwatt","value_u64":83831,"value_i64":null,"value_f64":null,"native_status":0,"timestamp_unix_ms":1788661824539},{"field":"power_instant_mw","provider":"NVML nvmlDeviceGetFieldValues","provider_native_id":186,"state":"available","origin":"driver_reported","value_type":"unsigned_integer","unit":"milliwatt","value_u64":89338,"value_i64":null,"value_f64":null,"native_status":0,"timestamp_unix_ms":1788661824539},{"field":"power_limit_min_mw","provider":"NVML nvmlDeviceGetFieldValues","provider_native_id":187,"state":"available","origin":"driver_reported","value_type":"unsigned_integer","unit":"milliwatt","value_u64":100000,"value_i64":null,"value_f64":null,"native_status":0,"timestamp_unix_ms":1788661824539},{"field":"power_limit_max_mw","provider":"NVML nvmlDeviceGetFieldValues","provider_native_id":188,"state":"available","origin":"driver_reported","value_type":"unsigned_integer","unit":"milliwatt","value_u64":170000,"value_i64":null,"value_f64":null,"native_status":0,"timestamp_unix_ms":1788661824539},{"field":"power_limit_default_mw","provider":"NVML nvmlDeviceGetFieldValues","provider_native_id":189,"state":"available","origin":"driver_reported","value_type":"unsigned_integer","unit":"milliwatt","value_u64":170000,"value_i64":null,"value_f64":null,"native_status":0,"timestamp_unix_ms":1788661824539},{"field":"power_limit_current_mw","provider":"NVML nvmlDeviceGetFieldValues","provider_native_id":190,"state":"available","origin":"driver_reported","value_type":"unsigned_integer","unit":"milliwatt","value_u64":170000,"value_i64":null,"value_f64":null,"native_status":0,"timestamp_unix_ms":1788661824539},{"field":"power_limit_requested_mw","provider":"NVML nvmlDeviceGetFieldValues","provider_native_id":192,"state":"available","origin":"driver_reported","value_type":"unsigned_integer","unit":"milliwatt","value_u64":170000,"value_i64":null,"value_f64":null,"native_status":0,"timestamp_unix_ms":1788661824539},{"field":"temperature_shutdown_c","provider":"NVML nvmlDeviceGetFieldValues","provider_native_id":193,"state":"not_supported","origin":"driver_reported","value_type":"unknown","unit":"celsius","value_u64":null,"value_i64":null,"value_f64":null,"native_status":3,"timestamp_unix_ms":1788661824539},{"field":"temperature_slowdown_c","provider":"NVML nvmlDeviceGetFieldValues","provider_native_id":194,"state":"not_supported","origin":"driver_reported","value_type":"unknown","unit":"celsius","value_u64":null,"value_i64":null,"value_f64":null,"native_status":3,"timestamp_unix_ms":1788661824539},{"field":"temperature_memory_max_c","provider":"NVML nvmlDeviceGetFieldValues","provider_native_id":195,"state":"not_supported","origin":"driver_reported","value_type":"unknown","unit":"celsius","value_u64":null,"value_i64":null,"value_f64":null,"native_status":3,"timestamp_unix_ms":1788661824539},{"field":"temperature_gpu_max_c","provider":"NVML nvmlDeviceGetFieldValues","provider_native_id":196,"state":"not_supported","origin":"driver_reported","value_type":"unknown","unit":"celsius","value_u64":null,"value_i64":null,"value_f64":null,"native_status":3,"timestamp_unix_ms":1788661824539},{"field":"clock_graphics_mhz","provider":"NVML nvmlDeviceGetClockInfo","provider_native_id":0,"state":"available","origin":"driver_reported","value_type":"unsigned_integer","unit":"megahertz","value_u64":1912,"value_i64":null,"value_f64":null,"native_status":0,"timestamp_unix_ms":1788661824538},{"field":"clock_sm_mhz","provider":"NVML nvmlDeviceGetClockInfo","provider_native_id":1,"state":"available","origin":"driver_reported","value_type":"unsigned_integer","unit":"megahertz","value_u64":1912,"value_i64":null,"value_f64":null,"native_status":0,"timestamp_unix_ms":1788661824538},{"field":"clock_memory_mhz","provider":"NVML nvmlDeviceGetClockInfo","provider_native_id":2,"state":"available","origin":"driver_reported","value_type":"unsigned_integer","unit":"megahertz","value_u64":7501,"value_i64":null,"value_f64":null,"native_status":0,"timestamp_unix_ms":1788661824538},{"field":"clock_video_mhz","provider":"NVML nvmlDeviceGetClockInfo","provider_native_id":3,"state":"available","origin":"driver_reported","value_type":"unsigned_integer","unit":"megahertz","value_u64":1680,"value_i64":null,"value_f64":null,"native_status":0,"timestamp_unix_ms":1788661824538},{"field":"utilization_gpu_percent","provider":"NVML nvmlDeviceGetUtilizationRates","provider_native_id":0,"state":"available","origin":"driver_reported","value_type":"unsigned_integer","unit":"percent","value_u64":60,"value_i64":null,"value_f64":null,"native_status":0,"timestamp_unix_ms":1788661824538},{"field":"utilization_memory_percent","provider":"NVML nvmlDeviceGetUtilizationRates","provider_native_id":1,"state":"available","origin":"driver_reported","value_type":"unsigned_integer","unit":"percent","value_u64":44,"value_i64":null,"value_f64":null,"native_status":0,"timestamp_unix_ms":1788661824538},{"field":"memory_total_bytes","provider":"NVML nvmlDeviceGetMemoryInfo","provider_native_id":0,"state":"available","origin":"driver_reported","value_type":"unsigned_integer","unit":"bytes","value_u64":12884901888,"value_i64":null,"value_f64":null,"native_status":0,"timestamp_unix_ms":1788661824538},{"field":"memory_free_bytes","provider":"NVML nvmlDeviceGetMemoryInfo","provider_native_id":1,"state":"available","origin":"driver_reported","value_type":"unsigned_integer","unit":"bytes","value_u64":9934942208,"value_i64":null,"value_f64":null,"native_status":0,"timestamp_unix_ms":1788661824538},{"field":"memory_used_bytes","provider":"NVML nvmlDeviceGetMemoryInfo","provider_native_id":2,"state":"available","origin":"driver_reported","value_type":"unsigned_integer","unit":"bytes","value_u64":2949959680,"value_i64":null,"value_f64":null,"native_status":0,"timestamp_unix_ms":1788661824538},{"field":"fan_speed_percent","provider":"NVML nvmlDeviceGetFanSpeed_v2","provider_native_id":0,"state":"available","origin":"driver_reported","value_type":"unsigned_integer","unit":"percent","value_u64":30,"value_i64":null,"value_f64":null,"native_status":0,"timestamp_unix_ms":1788661824538},{"field":"fan_speed_intended_rpm","provider":"NVML nvmlDeviceGetFanSpeedRPM","provider_native_id":0,"state":"available","origin":"driver_reported","value_type":"unsigned_integer","unit":"rpm","value_u64":1103,"value_i64":null,"value_f64":null,"native_status":0,"timestamp_unix_ms":1788661824538},{"field":"fan_speed_percent","provider":"NVML nvmlDeviceGetFanSpeed_v2","provider_native_id":1,"state":"available","origin":"driver_reported","value_type":"unsigned_integer","unit":"percent","value_u64":30,"value_i64":null,"value_f64":null,"native_status":0,"timestamp_unix_ms":1788661824538},{"field":"fan_speed_intended_rpm","provider":"NVML nvmlDeviceGetFanSpeedRPM","provider_native_id":1,"state":"available","origin":"driver_reported","value_type":"unsigned_integer","unit":"rpm","value_u64":1106,"value_i64":null,"value_f64":null,"native_status":0,"timestamp_unix_ms":1788661824538},{"field":"performance_state","provider":"NVML nvmlDeviceGetPerformanceState","provider_native_id":0,"state":"available","origin":"driver_reported","value_type":"signed_integer","unit":"pstate","value_u64":null,"value_i64":0,"value_f64":null,"native_status":0,"timestamp_unix_ms":1788661824538},{"field":"clock_event_reasons_current","provider":"NVML nvmlDeviceGetCurrentClocksEventReasons","provider_native_id":0,"state":"available","origin":"driver_reported","value_type":"bitmask","unit":"bitmask","value_u64":0,"value_i64":null,"value_f64":null,"native_status":0,"timestamp_unix_ms":1788661824538},{"field":"clock_event_reasons_supported","provider":"NVML nvmlDeviceGetSupportedClocksEventReasons","provider_native_id":0,"state":"available","origin":"driver_reported","value_type":"bitmask","unit":"bitmask","value_u64":511,"value_i64":null,"value_f64":null,"native_status":0,"timestamp_unix_ms":1788661824538},{"field":"encoder_utilization_percent","provider":"NVML nvmlDeviceGetEncoderUtilization","provider_native_id":0,"state":"available","origin":"driver_reported","value_type":"unsigned_integer","unit":"percent","value_u64":0,"value_i64":null,"value_f64":null,"native_status":0,"timestamp_un